grant_title,id,organization,total_amount,group,Grant start date,start_month,start_day,start_year
Intensive Partnership Site - Participation in MET Research Study,206,Hillsborough County Public Schools,2502146,ORG,10/20/2009,10,20,ORG
Scaling NCTQ state and district work,207,National Council on Teacher Quality,2565641,ORG,10/21/2009,10,21,ORG
NAPCS Industry Development,208,National Alliance For Public Charter Schools,2605527,ORG,9/1/2008,9,1,ORG
Increasing Business Engagement,209,Institute for a Competitive Workforce,2625837,ORG,10/8/2008,10,8,ORG
Building Support for Federal High School Policy Reform,210,"Alliance for Excellent Education, Inc.",2644892,ORG,9/1/2008,9,1,ORG
NYC DOE Measures of Teacher Effectiveness Research,211,Fund for Public Schools Inc.,2646876,ORG,8/28/2009,8,28,ORG
Aspire Public Schools' Early College High School Capacity Project,212,Aspire Public Schools,2899727,ORG,9/1/2008,9,1,ORG
Big 8 Superintendents Data Assessment,213,Communities Foundation of Texas,2901632,ORG,11/1/2008,11,1,ORG
National Impact Initiative,214,National Association Of Charter School Authorizers,2979186,ORG,10/1/2008,10,1,ORG
Development and Adaptation of Science and Literacy Formative Assessment Tasks,215,Regents Of The University Of California At Berkeley,2999730,ORG,11/20/2009,11,20,ORG
Research Alliance for New York City Schools,216,New York University,2999960,ORG,10/1/2008,10,1,ORG
CCSR General Operating Support,217,University of Chicago (Parent Org),3000000,ORG,5/1/2008,5,1,ORG
Deepening and Expanding the Impact of Diploma Plus,218,"Third Sector New England, Inc.",3179363,ORG,9/1/2008,9,1,ORG
To provide support to states on RTTT applications,219,New Venture Fund,3240000,ORG,11/4/2009,11,4,ORG
Alternative High School Initiative,220,The Big Picture Company,3315216,ORG,7/15/2009,7,15,ORG
Support for Teaching First to ensure that there is public support for district efforts to improve teacher effectiveness,221,"Rockefeller Philanthropy Advisors, Inc.",3487270,ORG,9/25/2009,9,25,ORG
IDEA Public Schools Expansion,222,Idea Academy Inc,3498875,ORG,11/1/2008,11,1,ORG
Title,223,College Summit Inc,3500000,ORG,5/1/2008,5,1,ORG
College Ready Mathematics Formative Assessments,224,Regents Of The University Of California At Berkeley,3661294,ORG,9/25/2009,9,25,ORG
Using Standards and Data to Improve Urban School Systems,225,Council Of The Great City Schools,3735866,ORG,10/1/2008,10,1,ORG
College Readiness Data Initiative,226,Dallas Independent School District,3774912,ORG,12/1/2008,12,1,ORG
Project support for expanding Aspen network,227,The Aspen Institute,3878680,ORG,11/18/2009,11,18,ORG
Aligned Instructional Systems,228,New Schools Fund dba NewSchools Venture Fund,3999127,ORG,5/1/2008,5,1,ORG
DC Schools Fund,229,New Schools Fund dba NewSchools Venture Fund,4000000,ORG,7/1/2008,7,1,ORG
Newark School Fund,230,"Newark Charter School Fund, Inc.",4000000,ORG,2/15/2008,2,15,ORG
SeaChange Capacity and Catalyst Funding,231,"SeaChange Capital Partners, Inc.",4000000,ORG,12/1/2008,12,1,ORG
College and Career Ready Graduation Initiative,232,United Way of America,4001263,ORG,1/1/2009,1,1,ORG
Elevating An Alternative Teacher Voice,233,"Teach Plus, Incorporated",4010611,ORG,9/30/2009,9,30,ORG
Big Picture School Initiative,234,The Big Picture Company,4079157,ORG,7/1/2008,7,1,ORG
Matching Grant for Classroom Projects in Public High Schools,235,DonorsChoose.org,4114700,ORG,11/1/2008,11,1,ORG
"Formative Assessment Data Collection, Task Analysis and Implementation (UCLA/CRESST)",236,Regents University Of California Los Angeles,4342988,ORG,11/12/2009,11,12,ORG
State and National Common Core Standards Adoption/Implementation Advocacy Support,237,"James B. Hunt, Jr. Institute for Educational Leadership and Policy Foundation, Inc.",4368176,ORG,11/5/2009,11,5,ORG
Ohio High School Value-Added Project,238,Battelle For Kids,4989262,ORG,10/1/2008,10,1,ORG
Creating a National Movement for Improved K-12 Education,239,"GreatSchools, Inc.",6000000,ORG,7/1/2008,7,1,ORG
Smart Scholars: Early College High Schools in New York State,240,The University of the State of New York,6000000,ORG,7/29/2009,7,29,ORG
Phase II - to support the expansion of second generation student tracker for high schools,241,National Student Clearinghouse Research Center,6094497,ORG,11/20/2009,11,20,ORG
Support for Seattle Public Schools' Strategic Plan,242,Alliance for Education,6929430,ORG,11/10/2008,11,10,ORG
Reforming the Widget Effect: Increasing teacher effectiveness in America's schools,243,"The New Teacher Project, Inc.",7000000,ORG,7/10/2009,7,10,ORG
Understanding Teacher Quality,244,Educational Testing Service,7348925,ORG,11/1/2008,11,1,ORG
Equity and Excellence in a Global Era: Expanding the International Studies Schools Network,245,Asia Society,7750417,ORG,11/1/2008,11,1,ORG
Increase the leadership capacity of chiefs,246,Council of Chief State School Officers,7770104,ORG,7/1/2009,7,1,ORG
Strong American Schools,247,"Rockefeller Philanthropy Advisors, Inc.",9958245,ORG,3/1/2008,3,1,ORG
Accelerated Partnership to Empower Effective Teachers,248,Denver Public Schools,10000000,ORG,1/4/2010,1,4,ORG
Accelerated Partnership to Empower Effective Teachers,249,Atlanta Public Schools,10000000,ORG,1/13/2010,1,13,ORG
American Diploma Project Network,250,Achieve Inc.,12614352,ORG,2/1/2008,2,1,ORG
Strategic Data Project,251,President and Fellows of Harvard College,14994686,ORG,6/17/2009,6,17,ORG
Intensive Partnerships to Empower Effective Teachers,252,Pittsburgh Public Schools,40000000,ORG,11/18/2009,11,18,ORG
Intensive Partnerships to Empower Effective Teachers (LA-CMO's),253,The College-Ready Promise,60000000,ORG,11/19/2009,11,19,ORG
Intensive Partnerships to Empower Effective Teachers,254,Memphis City Schools,90000000,ORG,11/19/2009,11,19,ORG
Intensive Partnerships to Empower Effective Teachers,255,Hillsborough County Public Schools,100000000,ORG,11/19/2009,11,19,ORG
